{
  "$schema": "https://json-schema.org/draft/2020-12/schema",
  "title": "Meal session",
  "type": "object",
  "additionalProperties": false,
  "required": ["id", "date", "meal", "title", "status", "recipeRefs"],
  "properties": {
    "id": { "type": "string", "minLength": 1 },
    "date": { "type": "string", "format": "date" },
    "meal": { "enum": ["breakfast", "lunch", "dinner", "other"] },
    "title": { "type": "string", "minLength": 1 },
    "status": { "enum": ["planned", "in_progress", "completed"] },
    "recipeRefs": {
      "type": "array", "minItems": 1,
      "items": {
        "type": "object", "additionalProperties": false,
        "required": ["recipeId", "version"],
        "properties": {
          "recipeId": { "type": "string", "minLength": 1 },
          "version": { "type": "string", "minLength": 1 }
        }
      }
    }
  }
}
